{
  "report_schema": "E2.1-PLATFORM-REPORT-v1",
  "status": "NOT_EVALUATED",
  "generated_at_utc": "2026-10-09T03:06:20.259320+00:00",
  "platform": {
    "system": "Windows",
    "release": "10",
    "machine": "AMD64",
    "python": "3.11.9"
  },
  "source": {
    "source_tree_sha256": "41361af3ed1805e1a52754539cbf28be1a0e7b9740d8d4c05ded121a71fdf4ea",
    "cargo_lock_sha256": "d1821ad44cb965d512de2f6b2f117acf17b93a76fd35381ed1e7a6e82027bcb4",
    "fixture_manifest_sha256": "6d3d3f8ff6f3bc978bf6478076181210624ebec898b5656591fff388903f5c11",
    "schema_manifest_sha256": "7068a6edbaef041fc4e163ddb6013c4a6409efa850747b99289b22021992f82d"
  },
  "check_set_sha256": "aa6b27da58019415ff10c6cdd9bfb88ad6b185ed93765fc87d21c7923c62d328",
  "gates": {
    "E21-G01": {
      "status": "PASS",
      "assertion": "v1基线未改变",
      "checks": [
        "e21-v1-baseline"
      ],
      "evidence_sha256": "91d54e3a429cacbb2ca74891b724566b0b082bb109a7f4770297968284898369"
    },
    "E21-G02": {
      "status": "PASS",
      "assertion": "v2模式、规范编码与CLI发布重开",
      "checks": [
        "e21-v2-schemas",
        "cargo-test-release",
        "cargo-build-cli",
        "e21-cli-workflow"
      ],
      "evidence_sha256": "33c382d7518dff2db70cb89e0c77e4a8f40460d64f810edb172d20261692d82f"
    },
    "E21-G03": {
      "status": "PASS",
      "assertion": "世界与生成身份分层",
      "checks": [
        "identity-layering"
      ],
      "evidence_sha256": "6e92461eddafe6985ef86f3509b3b66ccb714e327a65f3e790a22ad0a9fe2b91"
    },
    "E21-G04": {
      "status": "PASS",
      "assertion": "固定测试身份隔离",
      "checks": [
        "fixed-world-isolation"
      ],
      "evidence_sha256": "42a748df674b03300c78ca65c3da072cd81df97a36d7a8319a618e604ed46485"
    },
    "E21-G05": {
      "status": "PASS",
      "assertion": "板块骨架稳定",
      "checks": [
        "skeleton-stability"
      ],
      "evidence_sha256": "3ddd5a2b87cbd74469bb1bc61d19b33b56d5c45407b70b18c76cc1986c0586be"
    },
    "E21-G06": {
      "status": "PASS",
      "assertion": "活动倍率单因素关系",
      "checks": [
        "activity-metamorphism"
      ],
      "evidence_sha256": "b70f34c3421acaec47dee7e86d18e05a393643b924ce44f4d7fab033051d2b0c"
    },
    "E21-G07": {
      "status": "PASS",
      "assertion": "边界类型与强度分离",
      "checks": [
        "boundary-separation"
      ],
      "evidence_sha256": "0c0760068267f13ebc4bf0fe1d0f0dbc581dbe5c817bc6d9f114e69886d13861"
    },
    "E21-G08": {
      "status": "PASS",
      "assertion": "M1结构与自身自洽",
      "checks": [
        "m1-self-consistency"
      ],
      "evidence_sha256": "54ac6d905457b1ae74fcd43c2dc80e8d2132db62eb68519fd22e1c05db41ac45"
    },
    "E21-G09": {
      "status": "PASS",
      "assertion": "M1完整准入重建",
      "checks": [
        "m1-full-admission",
        "m1-filesystem-admission"
      ],
      "evidence_sha256": "e2da972b52d2026c654dbab3526358f27c7768eecdafac923575dea5a6e28432"
    },
    "E21-G10": {
      "status": "PASS",
      "assertion": "E1解析与边几何",
      "checks": [
        "edge-geometry",
        "query-semantics"
      ],
      "evidence_sha256": "6da2ceb37d1c2d0ede8cbc9fbe5e10f797738d4ba787261cd282600534bed4a5"
    },
    "E21-G11": {
      "status": "PASS",
      "assertion": "补丁谱系、晕区与2:1平衡",
      "checks": [
        "patch-reconstruction"
      ],
      "evidence_sha256": "36841509631d6a3d968d27de9720ac9d87b7a626e27b1ee7220310b05942ab8b"
    },
    "E21-G12": {
      "status": "PASS",
      "assertion": "D0/D1数值确定性",
      "checks": [
        "deterministic-numeric",
        "python-oracle"
      ],
      "evidence_sha256": "5a342a4128621fdc93b6082201c8497c02d0a8734d30d487cd801ba86592fae5"
    },
    "E21-G13": {
      "status": "PASS",
      "assertion": "真实1/2/4线程确定性",
      "checks": [
        "parallel-metamorphism"
      ],
      "evidence_sha256": "1bcfc1a82ac69d1c4acd85bd8f24cbe8d03048f89dd1289e8b4e20e3dc82cfad"
    },
    "E21-G14": {
      "status": "PASS",
      "assertion": "路径、事务和冲突处理",
      "checks": [
        "store-semantics"
      ],
      "evidence_sha256": "3490d415c48f95e4f2f43a32df27fc78adeb575af008223e2d0547a6f1ce8d66"
    },
    "E21-G15": {
      "status": "PASS",
      "assertion": "PCAL实际执行",
      "checks": [
        "pcal-execution"
      ],
      "evidence_sha256": "01ff5083dd131bc03e76d7619ce80b7db4ad94cf5e134fadf3a8b45233f86f7e"
    },
    "E21-G16": {
      "status": "PASS",
      "assertion": "PVAL独立执行",
      "checks": [
        "pval-execution"
      ],
      "evidence_sha256": "51ed90844faf9b480729dbca708f5c6eef13332c1c40458ed3e1d20a3b33f6e3"
    },
    "E21-G17": {
      "status": "PASS",
      "assertion": "固定件直接加载与覆盖",
      "checks": [
        "e21-fixture-audit",
        "cargo-test-release"
      ],
      "evidence_sha256": "5d4a93be6967ec60494a11085ef053dd4bc5d6c1d2bf5fd6c4ca4c7cf83e3e09"
    },
    "E21-G18": {
      "status": "NOT_EVALUATED",
      "assertion": "平台同源和同检查集合",
      "reason": "等待Windows原生报告",
      "checks": [],
      "evidence_sha256": "22aea7cc14b5a3f1bc8416cb31ff7d23aa02737d24e52d6eb63016654b0ae24d"
    },
    "E21-G19": {
      "status": "NOT_EVALUATED",
      "assertion": "跨平台权威证据一致",
      "reason": "等待macOS与Windows比较",
      "checks": [],
      "evidence_sha256": "d1d15022b970fc45c3061e427df68606535a865eafb32466571eea6c002f458e"
    },
    "E21-G20": {
      "status": "NOT_EVALUATED",
      "assertion": "冻结证据包完整",
      "reason": "等待E2.1-10冻结",
      "checks": [],
      "evidence_sha256": "dfba339d695e674fb53a1f54c5f11eb86833ea4c02f247746e1e9e0bf805321d"
    }
  },
  "checks": [
    {
      "name": "e21-v1-baseline",
      "status": "PASS",
      "return_code": 0,
      "duration_seconds": 0.0,
      "output_sha256": "34489959324962cd0953f8296d553f2ac7ddd2f77133ec6ce71c891847abe01e",
      "output": "{\"fixtures/manifest.json\": \"4205cd0f5c511cd39d62ea9f5bd2d79fa7ffcfc14cf89970ac2981e18fa0a785\", \"reports/e2/E2冻结验收报告.md\": \"66390296ce030234bfa97b40162e790a6dacdb21d18a86c810c31618e32409f4\", \"reports/e2/platform-comparison-macos-windows.json\": \"8d4d224c0fd2082a63679ce901e942fab00bf1462540e76a474361c154ca9293\", \"reports/e2/platform-darwin-arm64.json\": \"34b1d70be55b05ce1496ea68ddc1f7b8f81e057a9336cd8c23ab3dffc7864ce8\", \"reports/e2/platform-windows-amd64.json\": \"fbf387c2c252a9d93415e19c9ef93045acd3702ba644a210e20bada46aa86021\"}"
    },
    {
      "name": "e21-v2-schemas",
      "status": "PASS",
      "return_code": 0,
      "duration_seconds": 0.0,
      "output_sha256": "06069e976128e6f1f7e7848a69cdbac7c77dabd190a97069c2949adc424482c8",
      "output": "{\"e2.1-evidence-bundle-v1.schema.json\": \"planet-engine/e2.1-evidence-bundle-v1\", \"e2.1-platform-report-v1.schema.json\": \"planet-engine/e2.1-platform-report-v1\", \"generation-spec-v2.schema.json\": \"planet-engine/generation-spec-v2\", \"m1-input-release-v2.schema.json\": \"planet-engine/m1-input-release-v2\", \"spatial-release-v2.schema.json\": \"planet-engine/spatial-release-v2\", \"tectonics-release-v2.schema.json\": \"planet-engine/tectonics-release-v2\", \"world-intent-spec-v2.schema.json\": \"planet-engine/world-intent-spec-v2\"}"
    },
    {
      "name": "e21-fixture-audit",
      "status": "PASS",
      "return_code": 0,
      "duration_seconds": 0.0,
      "output_sha256": "d0e435f8f7238ad36b938bcdfdf644da293693858cbdcc4e4449c94ca63304a0",
      "output": "{\"fixture_ids\": [\"E21-B01\", \"E21-I01\", \"E21-M01\", \"E21-R01\", \"E21-S01\", \"E21-T01\", \"PCAL-E2.1-v2\", \"PVAL-E2.1-v2\"], \"fixture_paths\": [\"baselines/e2-v1-freeze.json\", \"identity/E21I01-world-kinds.json\", \"m1/E21M01-forged-claims.json\", \"spatial/E21S01-cross-face-patch.json\", \"statistical/PCAL-E2.1-v2.json\", \"statistical/PVAL-E2.1-v2.json\", \"storage/E21R01-safe-store-ids.json\", \"tectonics/E21T01-activity-metamorphic.json\"]}"
    },
    {
      "name": "identity-layering",
      "status": "PASS",
      "return_code": 0,
      "duration_seconds": 0.109,
      "output_sha256": "3b3e7d30436acb8f4a2c1dc8c39de3dcd15a4850350b059e93e6f85916535b82",
      "output": "\nrunning 1 test\n.\ntest result: ok. 1 passed; 0 failed; 0 ignored; 0 measured; 9 filtered out; finished in 0.00s\n\n"
    },
    {
      "name": "fixed-world-isolation",
      "status": "PASS",
      "return_code": 0,
      "duration_seconds": 0.109,
      "output_sha256": "3b3e7d30436acb8f4a2c1dc8c39de3dcd15a4850350b059e93e6f85916535b82",
      "output": "\nrunning 1 test\n.\ntest result: ok. 1 passed; 0 failed; 0 ignored; 0 measured; 9 filtered out; finished in 0.00s\n\n"
    },
    {
      "name": "skeleton-stability",
      "status": "PASS",
      "return_code": 0,
      "duration_seconds": 0.703,
      "output_sha256": "5b7ba589d67eec01fcd14dd33592c8f77d789919580f120c26ae86d71768d66d",
      "output": "\nrunning 1 test\n.\ntest result: ok. 1 passed; 0 failed; 0 ignored; 0 measured; 7 filtered out; finished in 0.57s\n\n"
    },
    {
      "name": "activity-metamorphism",
      "status": "PASS",
      "return_code": 0,
      "duration_seconds": 3.36,
      "output_sha256": "f7c16ca0e6a92661b5ea707eec94a1fc8abdf4a489d3f6a84bdc59c4188890be",
      "output": "\nrunning 1 test\n.\ntest result: ok. 1 passed; 0 failed; 0 ignored; 0 measured; 7 filtered out; finished in 3.27s\n\n"
    },
    {
      "name": "boundary-separation",
      "status": "PASS",
      "return_code": 0,
      "duration_seconds": 1.375,
      "output_sha256": "3b170775146d8f08df5272d7e28106024316cbdd4fee9a74d45d43d6e9d3ad6a",
      "output": "\nrunning 1 test\n.\ntest result: ok. 1 passed; 0 failed; 0 ignored; 0 measured; 7 filtered out; finished in 1.25s\n\n"
    },
    {
      "name": "m1-self-consistency",
      "status": "PASS",
      "return_code": 0,
      "duration_seconds": 0.125,